{
  "schema_version": "1.0",
  "sequence": 2,
  "generated_at": "2026-08-17T00:00:00Z",
  "expires_at": "2026-09-16T00:00:00Z",
  "packs": [
    {
      "pack_id": "chatmaker-board-arduino-nano-classic-knowledge",
      "pack_type": "knowledge",
      "version": "1.1.0",
      "board_id": "arduino-nano-classic",
      "url": "https://raw.githubusercontent.com/Amasun93/ChatMaker/d59f52648e832cd732c279b874c22c7b9a051aa2/distribution/packs/chatmaker-board-arduino-nano-classic-knowledge-1.1.0.cmpack",
      "length": 10908,
      "sha256": "520c7a3fd097380b3424832beae60af3b6a3ca7286c8c0f2c15f83e114bea8de",
      "compatibility": {
        "core": {"minimum": "0.1.0", "maximum_exclusive": "0.2.0"},
        "pack_manifest_schema": ["1.0"],
        "knowledge_index_schema": ["1.0"]
      }
    },
    {
      "pack_id": "chatmaker-board-arduino-uno-r3-knowledge",
      "pack_type": "knowledge",
      "version": "1.1.0",
      "board_id": "arduino-uno-r3",
      "url": "https://raw.githubusercontent.com/Amasun93/ChatMaker/d59f52648e832cd732c279b874c22c7b9a051aa2/distribution/packs/chatmaker-board-arduino-uno-r3-knowledge-1.1.0.cmpack",
      "length": 10712,
      "sha256": "13ccaaeddae9ea834a8b2d05d0fb767474343c36c05f7bce5295b5dc320fd914",
      "compatibility": {
        "core": {"minimum": "0.1.0", "maximum_exclusive": "0.2.0"},
        "pack_manifest_schema": ["1.0"],
        "knowledge_index_schema": ["1.0"]
      }
    },
    {
      "pack_id": "chatmaker-board-esp32-devkit-v1-knowledge",
      "pack_type": "knowledge",
      "version": "1.1.0",
      "board_id": "esp32-devkit-v1",
      "url": "https://raw.githubusercontent.com/Amasun93/ChatMaker/d59f52648e832cd732c279b874c22c7b9a051aa2/distribution/packs/chatmaker-board-esp32-devkit-v1-knowledge-1.1.0.cmpack",
      "length": 10902,
      "sha256": "2c1ec4d80c43db90547683c8fd3a7ec754acd1dd02389d4bfa1655bcf4b8311e",
      "compatibility": {
        "core": {"minimum": "0.1.0", "maximum_exclusive": "0.2.0"},
        "pack_manifest_schema": ["1.0"],
        "knowledge_index_schema": ["1.0"]
      }
    },
    {
      "pack_id": "chatmaker-board-idmc-0001-starcore-v4-2-2-knowledge",
      "pack_type": "knowledge",
      "version": "1.0.0",
      "board_id": "idmc-0001-starcore-v4-2-2",
      "url": "https://raw.githubusercontent.com/Amasun93/ChatMaker/d59f52648e832cd732c279b874c22c7b9a051aa2/distribution/packs/chatmaker-board-idmc-0001-starcore-v4-2-2-knowledge-1.0.0.cmpack",
      "length": 14752,
      "sha256": "ef8c4635db058cf25399fa1840e43386a8e0ca3850199076e6b5986010e534b7",
      "compatibility": {
        "core": {"minimum": "0.1.0", "maximum_exclusive": "0.2.0"},
        "pack_manifest_schema": ["1.0"],
        "knowledge_index_schema": ["1.0"]
      }
    }
  ]
}
